{
  "$schema": "https://json-schema.org/draft/2020-12/schema",
  "$id": "https://marola.example/board.schema.json",
  "title": "marola board",
  "description": "One area, one day: every nearby beach with every daylight hour scored (MIP-0005 §5.2). Written by marola.site.Board, read by site/static/app.js. Numbers are the same the CLI prints; null means the upstream had no value.",
  "type": "object",
  "required": ["schema", "area", "day", "today", "generated_at", "sources", "lore", "beaches"],
  "additionalProperties": false,
  "properties": {
    "schema": { "type": "integer", "enum": [1, 2], "description": "2 adds note_codes (MIP-0054 §5.1); a schema-1 board still validates" },
    "area": { "type": "string" },
    "day": { "type": "string", "description": "ISO date the hours belong to, in the area's zone" },
    "today": { "type": "string", "description": "ISO date the board was computed for ('today' in the area's zone) — water-quality freshness is judged against it" },
    "generated_at": { "type": "string", "description": "ISO-8601 with offset; shown on the page so a stale board is visible" },
    "sources": {
      "type": "object",
      "required": ["beaches", "forecast", "water"],
      "additionalProperties": false,
      "properties": {
        "beaches": { "type": "string" },
        "forecast": { "type": "string" },
        "water": { "type": ["string", "null"] }
      }
    },
    "lore": {
      "description": "The day's sea-lore paragraph, verbatim, with its source (MIP-0001 §5.4); null when none is eligible",
      "type": ["object", "null"],
      "required": ["kind", "text", "source", "lang"],
      "additionalProperties": false,
      "properties": {
        "kind": { "type": "string", "enum": ["secret", "creature"] },
        "text": { "type": "string" },
        "source": { "type": "string" },
        "lang": { "type": "string" }
      }
    },
    "beaches": { "type": "array", "items": { "$ref": "#/$defs/beach" } },
    "trails": {
      "description": "MIP-0030: named coastal/lakeside OSM trails within 500m of a beach or a named lake in this area — additive, optional (an older board written before this field existed has none, and still validates)",
      "type": "array",
      "items": { "$ref": "#/$defs/trail" }
    }
  },
  "$defs": {
    "likelihood": { "type": "string", "enum": ["Low", "Moderate", "High"] },
    "note_codes": {
      "description": "MIP-0054 §5.1: the same reasons as notes, in the same order, as codes the page words per language. Optional: a schema-1 board has none. args: numbers stay numbers, dates are ISO strings. Per code: rough_seas/choppy {wave_m}; strong_wind/breezy {wind_kmh}; cold_water/warm_water {sea_temp_c}; rain_likely {rain_pct}; water_stale {sampled_on}; water_unfit {source, sampled_on, point, location, enterococci_per_100ml (absent when unknown)}; water_mixed {proper, total, avoid: [location]}; no_wave_data, no_wind_data, no_sea_temp_data, dark, jellyfish_elevated, jellyfish_some {}",
      "type": "array",
      "items": {
        "type": "object",
        "required": ["code", "args"],
        "additionalProperties": false,
        "properties": {
          "code": { "type": "string", "enum": ["rough_seas", "choppy", "no_wave_data", "strong_wind", "breezy", "no_wind_data", "cold_water", "warm_water", "no_sea_temp_data", "rain_likely", "dark", "jellyfish_elevated", "jellyfish_some", "water_stale", "water_unfit", "water_mixed"] },
          "args": { "type": "object" }
        }
      }
    },
    "hhmm": { "type": "string", "description": "local time, HH:mm" },
    "near_anchor": {
      "description": "the nearer beach/lake anchor of this kind, or null when none is within 500m (or none nearby carries a name)",
      "type": ["object", "null"],
      "required": ["name", "distance_km"],
      "additionalProperties": false,
      "properties": {
        "name": { "type": "string" },
        "distance_km": { "type": "number" }
      }
    },
    "trail": {
      "type": "object",
      "required": ["name", "length_km", "difficulty", "surface", "geometry", "near_beach", "near_lake"],
      "additionalProperties": false,
      "properties": {
        "name": { "type": "string" },
        "length_km": { "type": "number" },
        "difficulty": { "type": ["string", "null"], "description": "OSM sac_scale, verbatim, e.g. 'hiking', 'mountain_hiking'; null when the tag is absent" },
        "surface": { "type": ["string", "null"], "description": "OSM surface, verbatim; null when the tag is absent" },
        "geometry": {
          "type": "array",
          "description": "the trail's node sequence, [lat, lon] pairs, in map-drawing order",
          "items": { "type": "array", "items": { "type": "number" } }
        },
        "near_beach": { "$ref": "#/$defs/near_anchor" },
        "near_lake": { "$ref": "#/$defs/near_anchor" }
      }
    },
    "beach": {
      "type": "object",
      "required": ["name", "lat", "lon", "best", "hours", "water", "tides", "sea", "jellyfish", "whales"],
      "additionalProperties": false,
      "properties": {
        "name": { "type": "string" },
        "lat": { "type": "number" },
        "lon": { "type": "number" },
        "best": {
          "type": "object",
          "required": ["hour", "score", "notes"],
          "additionalProperties": false,
          "properties": {
            "hour": { "$ref": "#/$defs/hhmm" },
            "score": { "type": "integer", "description": "0-100; 0 with water.unfit=true is a veto" },
            "notes": { "type": "array", "items": { "type": "string" } },
            "note_codes": { "$ref": "#/$defs/note_codes" }
          }
        },
        "hours": {
          "type": "array",
          "description": "every daylight hour of the day, chronological (the slider)",
          "items": {
            "type": "object",
            "required": ["h", "score", "notes", "sea_temp_c", "wave_m", "wind_kmh", "jellyfish", "whales"],
            "additionalProperties": false,
            "properties": {
              "h": { "$ref": "#/$defs/hhmm" },
              "score": { "type": "integer" },
              "notes": { "type": "array", "items": { "type": "string" } },
              "note_codes": { "$ref": "#/$defs/note_codes" },
              "sea_temp_c": { "type": ["number", "null"] },
              "wave_m": { "type": ["number", "null"] },
              "wind_kmh": { "type": ["number", "null"] },
              "wind_level": { "type": ["string", "null"], "enum": ["calm", "breezy", "strong", null] },
              "jellyfish": { "$ref": "#/$defs/likelihood" },
              "whales": { "$ref": "#/$defs/likelihood" }
            }
          }
        },
        "water": {
          "type": "object",
          "required": ["summary", "unfit", "note", "source", "points"],
          "additionalProperties": false,
          "properties": {
            "summary": { "type": "string", "description": "the CLI's water column, e.g. '4/5 PRÓPRIA — avoid Ponto 73 (25 Aug)' or 'no data'" },
            "unfit": { "type": "boolean", "description": "true = every fresh point IMPRÓPRIA: red marker, score 0" },
            "note": { "type": ["string", "null"] },
            "source": { "type": ["string", "null"] },
            "points": {
              "type": "array",
              "items": {
                "type": "object",
                "required": ["point", "location", "lat", "lon", "condition", "sampled_on", "enterococci_per_100ml", "rain"],
                "additionalProperties": false,
                "properties": {
                  "point": { "type": "string" },
                  "location": { "type": "string" },
                  "lat": { "type": "number" },
                  "lon": { "type": "number" },
                  "condition": { "type": "string", "enum": ["proper", "improper", "unknown"] },
                  "sampled_on": { "type": "string" },
                  "enterococci_per_100ml": { "type": ["integer", "null"] },
                  "rain": { "type": ["string", "null"] }
                }
              }
            }
          }
        },
        "tides": {
          "type": "array",
          "items": {
            "type": "object",
            "required": ["time", "m", "high"],
            "additionalProperties": false,
            "properties": {
              "time": { "$ref": "#/$defs/hhmm" },
              "m": { "type": "number" },
              "high": { "type": "boolean" }
            }
          }
        },
        "sea": {
          "type": "object",
          "description": "conditions at the best hour",
          "required": ["temp_c", "wave_m", "period_s", "wave_dir_deg", "swell_m", "swell_period_s", "current_kmh", "wind_kmh", "wind_dir_deg", "air_temp_c", "uv", "rain_pct"],
          "additionalProperties": false,
          "properties": {
            "temp_c": { "type": ["number", "null"] },
            "wave_m": { "type": ["number", "null"] },
            "period_s": { "type": ["number", "null"] },
            "wave_dir_deg": { "type": ["number", "null"] },
            "swell_m": { "type": ["number", "null"] },
            "swell_period_s": { "type": ["number", "null"] },
            "current_kmh": { "type": ["number", "null"] },
            "wind_kmh": { "type": ["number", "null"] },
            "wind_dir_deg": { "type": ["number", "null"] },
            "air_temp_c": { "type": ["number", "null"] },
            "uv": { "type": ["number", "null"] },
            "rain_pct": { "type": ["number", "null"] }
          }
        },
        "jellyfish": { "$ref": "#/$defs/likelihood" },
        "whales": {
          "type": "object",
          "required": ["now", "peak", "season"],
          "additionalProperties": false,
          "properties": {
            "now": { "$ref": "#/$defs/likelihood" },
            "peak": { "type": ["string", "null"] },
            "season": { "type": "boolean" }
          }
        },
        "facilities": {
          "type": "object",
          "description": "MIP-0021: OSM amenity counts within 300m of this beach. Optional and additionalProperties:false so an older board built before this MIP still validates unchanged; absent keys = no data for that facility, never a zeroed count.",
          "additionalProperties": false,
          "properties": {
            "parking": { "type": "integer" },
            "toilets": { "type": "integer" },
            "shower": { "type": "integer" },
            "lifeguard": { "type": "integer" }
          }
        }
      }
    }
  }
}
