{
  "schema": 1,
  "area": "fixture",
  "day": "2026-09-06",
  "today": "2026-09-06",
  "generated_at": "2026-09-06T06:00:00-03:00",
  "sources": { "beaches": "OpenStreetMap/Overpass", "forecast": "Open-Meteo", "water": "IMA/SC" },
  "lore": null,
  "beaches": [
    {
      "name": "Praia da Joaquina",
      "lat": -27.6296,
      "lon": -48.4487,
      "best": { "hour": "10:00", "score": 55, "notes": ["breezy (27km/h)", "cold water (19.0°C)"] },
      "hours": [
        { "h": "07:00", "score": 48, "notes": ["cold water (19.2°C)"], "sea_temp_c": 19.2, "wave_m": 1.1, "wind_kmh": 12.0, "wind_level": "calm", "jellyfish": "Low", "whales": "Moderate" },
        { "h": "10:00", "score": 55, "notes": ["breezy (27km/h)", "cold water (19.0°C)"], "sea_temp_c": 19.0, "wave_m": 1.3, "wind_kmh": 27.0, "wind_level": "breezy", "jellyfish": "Low", "whales": "Low" },
        { "h": "13:00", "score": 30, "notes": ["strong wind (33km/h)", "cold water (19.4°C)"], "sea_temp_c": 19.4, "wave_m": 1.4, "wind_kmh": 33.0, "wind_level": "strong", "jellyfish": "Low", "whales": "Low" }
      ],
      "facilities": { "parking": 3, "toilets": 1 },
      "water": {
        "summary": "1/1 PRÓPRIA (25 Aug)",
        "unfit": false,
        "note": null,
        "source": "IMA/SC",
        "points": [
          { "point": "Ponto 33", "location": "Joaquina", "lat": -27.6301, "lon": -48.4479, "condition": "proper", "sampled_on": "2026-08-25", "enterococci_per_100ml": 12, "rain": null }
        ]
      },
      "tides": [ { "time": "06:40", "m": 0.9, "high": true }, { "time": "12:50", "m": -0.7, "high": false } ],
      "sea": { "temp_c": 19.0, "wave_m": 1.3, "period_s": 6.0, "wave_dir_deg": 140.0, "swell_m": 1.0, "swell_period_s": 9.0, "current_kmh": 1.2, "wind_kmh": 27.0, "wind_dir_deg": 180.0, "air_temp_c": 22.0, "uv": 5.0, "rain_pct": 10.0 },
      "jellyfish": "Low",
      "whales": { "now": "Low", "peak": "07:00", "season": true }
    },
    {
      "name": "Praia Brava",
      "lat": -27.4021,
      "lon": -48.4157,
      "best": { "hour": "09:00", "score": 0, "notes": ["water unfit (IMPRÓPRIA)"] },
      "hours": [
        { "h": "09:00", "score": 0, "notes": ["water unfit (IMPRÓPRIA)"], "sea_temp_c": 20.1, "wave_m": 0.5, "wind_kmh": 9.0, "wind_level": "calm", "jellyfish": "Moderate", "whales": "High" },
        { "h": "12:00", "score": 0, "notes": ["water unfit (IMPRÓPRIA)"], "sea_temp_c": null, "wave_m": 0.6, "wind_kmh": 18.0, "jellyfish": "Moderate", "whales": "High" }
      ],
      "water": {
        "summary": "0/1 IMPRÓPRIA (25 Aug)",
        "unfit": true,
        "note": "avoid — every fresh point unfit",
        "source": "IMA/SC",
        "points": [
          { "point": "Ponto 12", "location": "Brava", "lat": -27.4030, "lon": -48.4150, "condition": "improper", "sampled_on": "2026-08-25", "enterococci_per_100ml": 800, "rain": "rain in the last 24h" }
        ]
      },
      "tides": [],
      "sea": { "temp_c": 20.1, "wave_m": 0.5, "period_s": null, "wave_dir_deg": null, "swell_m": null, "swell_period_s": null, "current_kmh": null, "wind_kmh": 9.0, "wind_dir_deg": 45.0, "air_temp_c": 24.0, "uv": null, "rain_pct": null },
      "jellyfish": "Moderate",
      "whales": { "now": "High", "peak": "09:00", "season": true }
    }
  ]
}
